{
  "metadata": {
    "run_id": "synthetic-run",
    "generated_date": "2026-07-14T00:00:00Z",
    "agent": "02-funnel-velocity",
    "total_deals": 50,
    "deals_included": 50,
    "deals_excluded": {
      "count": 0,
      "deal_ids": []
    },
    "deal_counts_by_outcome": {
      "won": 14,
      "lost": 21,
      "open": 15
    },
    "deal_counts_by_stage": {
      "lead": 50,
      "mql": 50,
      "sql": 40,
      "opportunity": 34,
      "closed": 35
    },
    "stage_skipping_deals": {
      "count": 0,
      "deal_ids": []
    },
    "stalled_deals": [
      {
        "deal_id": "DEAL-002",
        "current_stage": "Opportunity",
        "days_stalled": 306
      },
      {
        "deal_id": "DEAL-005",
        "current_stage": "Opportunity",
        "days_stalled": 312
      },
      {
        "deal_id": "DEAL-006",
        "current_stage": "SQL",
        "days_stalled": 326
      },
      {
        "deal_id": "DEAL-007",
        "current_stage": "Opportunity",
        "days_stalled": 327
      },
      {
        "deal_id": "DEAL-014",
        "current_stage": "Opportunity",
        "days_stalled": 254
      },
      {
        "deal_id": "DEAL-020",
        "current_stage": "SQL",
        "days_stalled": 245
      },
      {
        "deal_id": "DEAL-026",
        "current_stage": "SQL",
        "days_stalled": 197
      },
      {
        "deal_id": "DEAL-028",
        "current_stage": "SQL",
        "days_stalled": 170
      },
      {
        "deal_id": "DEAL-033",
        "current_stage": "Opportunity",
        "days_stalled": 140
      },
      {
        "deal_id": "DEAL-036",
        "current_stage": "SQL",
        "days_stalled": 146
      }
    ],
    "data_quality_warnings": [],
    "analysis_date": "2026-07-14"
  },
  "stage_velocity": {
    "lead_to_mql": {
      "overall": {
        "avg": 12.4,
        "median": 12.0,
        "p90": 18.1,
        "min": 1,
        "max": 23,
        "deal_count": 50
      },
      "by_industry": {
        "Financial Services": {
          "avg": 15.0,
          "median": 15,
          "p90": 19.8,
          "min": 7,
          "max": 21,
          "deal_count": 7
        },
        "Healthcare": {
          "avg": 13.8,
          "median": 14,
          "p90": 19.0,
          "min": 4,
          "max": 23,
          "deal_count": 9
        },
        "Manufacturing": {
          "avg": 11.4,
          "median": 11,
          "p90": 16.6,
          "min": 5,
          "max": 19,
          "deal_count": 9
        },
        "Professional Services": {
          "avg": 13.6,
          "median": 16,
          "p90": 16.8,
          "min": 7,
          "max": 18,
          "deal_count": 7
        },
        "Retail/E-commerce": {
          "avg": 10.5,
          "median": 10.5,
          "p90": 10.9,
          "min": 10,
          "max": 11,
          "deal_count": 2,
          "low_confidence": true
        },
        "Technology": {
          "avg": 10.7,
          "median": 10.0,
          "p90": 15.0,
          "min": 1,
          "max": 22,
          "deal_count": 16
        }
      },
      "by_company_size": {
        "Enterprise": {
          "avg": 11.1,
          "median": 10.5,
          "p90": 16.9,
          "min": 1,
          "max": 21,
          "deal_count": 22
        },
        "Mid-Market": {
          "avg": 14.1,
          "median": 13,
          "p90": 20.4,
          "min": 8,
          "max": 23,
          "deal_count": 15
        },
        "SMB": {
          "avg": 12.5,
          "median": 14,
          "p90": 17.6,
          "min": 5,
          "max": 19,
          "deal_count": 13
        }
      },
      "by_lead_source": {
        "Event": {
          "avg": 14.4,
          "median": 16,
          "p90": 20.2,
          "min": 4,
          "max": 21,
          "deal_count": 5
        },
        "Inbound": {
          "avg": 13.4,
          "median": 14,
          "p90": 18.8,
          "min": 4,
          "max": 23,
          "deal_count": 19
        },
        "Outbound": {
          "avg": 10.6,
          "median": 10.5,
          "p90": 15.8,
          "min": 1,
          "max": 19,
          "deal_count": 12
        },
        "Partner": {
          "avg": 13.5,
          "median": 14.0,
          "p90": 16.1,
          "min": 9,
          "max": 17,
          "deal_count": 4,
          "low_confidence": true
        },
        "Referral": {
          "avg": 11.1,
          "median": 11.0,
          "p90": 13.2,
          "min": 7,
          "max": 15,
          "deal_count": 10
        }
      },
      "by_deal_type": {
        "Expansion": {
          "avg": 12.4,
          "median": 13,
          "p90": 14.4,
          "min": 7,
          "max": 16,
          "deal_count": 9
        },
        "New Business": {
          "avg": 12.5,
          "median": 10.5,
          "p90": 20.0,
          "min": 1,
          "max": 23,
          "deal_count": 26
        },
        "Renewal": {
          "avg": 12.1,
          "median": 12,
          "p90": 16.0,
          "min": 7,
          "max": 19,
          "deal_count": 15
        }
      },
      "by_geography": {
        "APAC": {
          "avg": 13.6,
          "median": 11.0,
          "p90": 19.6,
          "min": 9,
          "max": 21,
          "deal_count": 8
        },
        "Europe": {
          "avg": 12.9,
          "median": 13,
          "p90": 17.6,
          "min": 4,
          "max": 23,
          "deal_count": 13
        },
        "North America": {
          "avg": 11.8,
          "median": 11,
          "p90": 17.2,
          "min": 1,
          "max": 22,
          "deal_count": 29
        }
      }
    },
    "mql_to_sql": {
      "overall": {
        "avg": 14.5,
        "median": 15.5,
        "p90": 23.0,
        "min": 1,
        "max": 28,
        "deal_count": 40
      },
      "by_industry": {
        "Financial Services": {
          "avg": 9.8,
          "median": 9.0,
          "p90": 18.5,
          "min": 1,
          "max": 20,
          "deal_count": 6
        },
        "Healthcare": {
          "avg": 16.4,
          "median": 18,
          "p90": 22.2,
          "min": 1,
          "max": 24,
          "deal_count": 7
        },
        "Manufacturing": {
          "avg": 15.5,
          "median": 15.0,
          "p90": 21.5,
          "min": 8,
          "max": 25,
          "deal_count": 6
        },
        "Professional Services": {
          "avg": 16.5,
          "median": 16.0,
          "p90": 24.0,
          "min": 5,
          "max": 28,
          "deal_count": 6
        },
        "Retail/E-commerce": {
          "avg": 10.5,
          "median": 10.5,
          "p90": 16.5,
          "min": 3,
          "max": 18,
          "deal_count": 2,
          "low_confidence": true
        },
        "Technology": {
          "avg": 14.9,
          "median": 13,
          "p90": 22.6,
          "min": 9,
          "max": 23,
          "deal_count": 13
        }
      },
      "by_company_size": {
        "Enterprise": {
          "avg": 12.9,
          "median": 13,
          "p90": 21.0,
          "min": 1,
          "max": 23,
          "deal_count": 15
        },
        "Mid-Market": {
          "avg": 16.3,
          "median": 18,
          "p90": 24.6,
          "min": 1,
          "max": 28,
          "deal_count": 15
        },
        "SMB": {
          "avg": 14.3,
          "median": 15.0,
          "p90": 20.1,
          "min": 5,
          "max": 21,
          "deal_count": 10
        }
      },
      "by_lead_source": {
        "Event": {
          "avg": 14.8,
          "median": 17,
          "p90": 21.0,
          "min": 1,
          "max": 23,
          "deal_count": 5
        },
        "Inbound": {
          "avg": 15.0,
          "median": 14,
          "p90": 22.2,
          "min": 5,
          "max": 28,
          "deal_count": 17
        },
        "Outbound": {
          "avg": 15.0,
          "median": 17,
          "p90": 19.8,
          "min": 7,
          "max": 21,
          "deal_count": 5
        },
        "Partner": {
          "avg": 11.5,
          "median": 11.0,
          "p90": 18.0,
          "min": 3,
          "max": 21,
          "deal_count": 4,
          "low_confidence": true
        },
        "Referral": {
          "avg": 14.6,
          "median": 18,
          "p90": 23.4,
          "min": 1,
          "max": 25,
          "deal_count": 9
        }
      },
      "by_deal_type": {
        "Expansion": {
          "avg": 17.3,
          "median": 17.5,
          "p90": 20.5,
          "min": 12,
          "max": 21,
          "deal_count": 6
        },
        "New Business": {
          "avg": 13.8,
          "median": 13.5,
          "p90": 23.0,
          "min": 1,
          "max": 28,
          "deal_count": 22
        },
        "Renewal": {
          "avg": 14.5,
          "median": 13.5,
          "p90": 20.9,
          "min": 1,
          "max": 25,
          "deal_count": 12
        }
      },
      "by_geography": {
        "APAC": {
          "avg": 10.9,
          "median": 8,
          "p90": 22.0,
          "min": 1,
          "max": 28,
          "deal_count": 7
        },
        "Europe": {
          "avg": 17.3,
          "median": 20,
          "p90": 23,
          "min": 5,
          "max": 24,
          "deal_count": 11
        },
        "North America": {
          "avg": 14.3,
          "median": 14.5,
          "p90": 21.0,
          "min": 1,
          "max": 25,
          "deal_count": 22
        }
      }
    },
    "sql_to_opp": {
      "overall": {
        "avg": 20.7,
        "median": 18.0,
        "p90": 36.4,
        "min": 0,
        "max": 67,
        "deal_count": 34
      },
      "by_industry": {
        "Financial Services": {
          "avg": 32.4,
          "median": 23,
          "p90": 52.6,
          "min": 19,
          "max": 63,
          "deal_count": 5
        },
        "Healthcare": {
          "avg": 22.2,